incident_id,created_at_iso,mode,route_id,route_short_name,stops_impacted,summary_en,plain_en,zh,ar,source,source_url
41d53121-9d36-511a-8205-6c9260549053,2025-08-14T13:42:59+10:00,train,aus:vic:vic-02-HBE:;aus:vic:vic-02-HBE-R:,Alamein,vic:rail:ROS,17 car spaces in Beetham Parade car park closed from 27 May to 14 August for project works.,"From 27 May to 14 August, 17 parking spaces in Beetham Parade car park are closed for work. Follow signs for safety.",从5月27日到8月14日， 停车场的17个停车位因工程关闭。请遵循安全标志。,من 27 مايو إلى 14 أغسطس، سيتم إغلاق 17 مكانًا لوقوف السيارات في موقف سيارات   لأعمال المشروع. يرجى اتباع العلامات.,gtfs-rt,https://api.opendata.transport.vic.gov.au/opendata/public-transport/gtfs/realtime/v1/metro/service-alerts
b87d5e70-2299-5853-a83b-348bced5dbd3,2025-08-14T13:42:59+10:00,train,aus:vic:vic-02-BEG:;aus:vic:vic-02-BEG-R:,Alamein,vic:rail:BAY;vic:rail:BOR;vic:rail:UPW;vic:rail:FTG;vic:rail:UFG;vic:rail:HMT;vic:rail:RWD;vic:rail:TCM;vic:rail:BEG,"Disruption from 8.30pm to last service, 10 to 14 August.",Services will be disrupted from 8.30pm until the last service each night from 10 to 14 August.,从8月10日至8月14日，每晚8:30到最后一班服务将会有干扰。,سيكون هناك اضطراب من الساعة 8:30 مساءً حتى آخر خدمة، من 10 إلى 14 أغسطس.,gtfs-rt,https://api.opendata.transport.vic.gov.au/opendata/public-transport/gtfs/realtime/v1/metro/service-alerts
87f79552-9a88-5c8a-9159-cf0697b5f04c,2025-08-14T13:42:59+10:00,train,aus:vic:vic-02-WER:;aus:vic:vic-02-WER-R:,Alamein,,Buses replace trains on Werribee line from 8:30pm 8 Aug to 17 Aug. Extra travel time needed.,Buses will replace trains on the Werribee line from 8:30pm on 8 August until 17 August. Extra travel time is needed.,从8月8日晚上8:30到8月17日，巴士将替代韦里比火车线的火车。需要额外的旅行时间。,ستحل الحافلات محل القطارات على خط ويريبى من الساعة 8:30 مساءً في 8 أغسطس حتى 17 أغسطس. يحتاج الأمر إلى وقت سفر إضافي.,gtfs-rt,https://api.opendata.transport.vic.gov.au/opendata/public-transport/gtfs/realtime/v1/metro/service-alerts
61e29a1e-e076-5f24-8c48-4076e65c9eba,2025-08-14T13:42:59+10:00,train,,,vic:rail:BMS;vic:rail:ESD;vic:rail:GBV;vic:rail:PVL;vic:rail:NME;vic:rail:NKT;vic:rail:FGS;vic:rail:JAC;vic:rail:FSS;vic:rail:RXP;vic:rail:CGB;vic:rail:MPD;vic:rail:SME;vic:rail:PAR;vic:rail:ASV;vic:rail:MCE;vic:rail:GRY;vic:rail:CLO;vic:rail:OKP;vic:rail:KEN,"The 1:34pm train from Flinders Street to Craigieburn will run direct to North Melbourne, skipping the City Loop.",The 1:34pm train from Flinders Street to Craigieburn will go straight to North Melbourne and will not stop at the City Loop.,下午1:34从弗林德斯街到克雷吉本的火车将直接前往北墨尔本，不经过市环线。,ستسير قطار الساعة 1:34 من محطة فليندرز إلى كرايجيبورن مباشرة إلى شمال ملبورن دون المرور عبر حلقة المدينة.,gtfs-rt,https://api.opendata.transport.vic.gov.au/opendata/public-transport/gtfs/realtime/v1/metro/service-alerts
388c1a47-88a3-5ddc-8ff9-1e8606f801b2,2025-08-14T13:42:59+10:00,train,,,vic:rail:WBH;vic:rail:FSS;vic:rail:WIL;vic:rail:SKN;vic:rail:SEN;vic:rail:NPT;vic:rail:NME;vic:rail:NWN;vic:rail:YVE;vic:rail:SSS;vic:rail:SPT;vic:rail:FSY,The 1:16pm Flinders Street to Williamstown service is delayed by 10 minutes.,The 1:16pm train from Flinders Street to Williamstown is running 10 minutes late.,弗林德斯街到威廉斯镇的1:16服务延迟了10分钟。,خدمة الساعة 1:16 مساءً من فليندرز ستريت إلى ويليامزتاون تأخرت لمدة 10 دقائق.,gtfs-rt,https://api.opendata.transport.vic.gov.au/opendata/public-transport/gtfs/realtime/v1/metro/service-alerts
427ea007-cf3f-51be-979a-62ce9feee5fb,2025-08-14T13:42:59+10:00,train,,,vic:rail:SNP;vic:rail:OFC;vic:rail:MRB;vic:rail:PKM;vic:rail:HUG;vic:rail:DNG;vic:rail:CDA;vic:rail:HUN;vic:rail:BEW;vic:rail:OAK;vic:rail:SSS;vic:rail:CNE;vic:rail:MAL;vic:rail:NPK;vic:rail:FGS;vic:rail:SYR;vic:rail:FSS;vic:rail:NWA;vic:rail:HLM;vic:rail:WTL;vic:rail:YMN;vic:rail:CFD;vic:rail:RMD;vic:rail:BFD;vic:rail:SPG;vic:rail:PAR;vic:rail:MCE;vic:rail:CLA,1:23pm East Pakenham to Flinders Street service delayed by 10 minutes.,The 1:23pm train from East Pakenham to Flinders Street is 10 minutes late.,东帕肯汉姆到弗林德斯街的1:23服务延迟了10分钟。,خدمة 1:23 مساءً من إيست باكنهام إلى شارع فليندرز تأخرت 10 دقائق.,gtfs-rt,https://api.opendata.transport.vic.gov.au/opendata/public-transport/gtfs/realtime/v1/metro/service-alerts
5d97b703-2f4d-545c-9d39-452bfac91c7a,2025-08-14T13:42:59+10:00,train,aus:vic:vic-02-WIL:;aus:vic:vic-02-WIL-R:;aus:vic:vic-02-WER:;aus:vic:vic-02-WER-R:,Alamein,,12 car spaces at Newport Station closed from 7pm 10 August to 4am 15 August for maintenance.,"From 7pm on 10 August to 4am on 15 August, 12 car spaces at Newport Station will be closed for maintenance.",由于维护工作，8月10日晚上7点至8月15日凌晨4点，纽波特车站将暂时关闭12个停车位。,بسبب أعمال الصيانة، سيتم إغلاق 12 مكانًا لوقوف السيارات في محطة نيو بورت من الساعة 7 مساءً في 10 أغسطس حتى الساعة 4 صباحًا في 15 أغسطس.,gtfs-rt,https://api.opendata.transport.vic.gov.au/opendata/public-transport/gtfs/realtime/v1/metro/service-alerts
1b79371b-4c62-578e-a395-512821e5dcdf,2025-08-14T13:42:59+10:00,train,aus:vic:vic-02-WER:;aus:vic:vic-02-WER-R:,Alamein,vic:rail:LAV;vic:rail:ACF;vic:rail:WLD;vic:rail:HCG;vic:rail:WER,First service on Thursday 14 August until 8.30pm Friday 15 August.,The first service will run from Thursday 14 August until 8.30pm on Friday 15 August.,第一班服务将于8月14日星期四开始，直到8月15日星期五晚上8:30。,ستبدأ الخدمة الأولى يوم الخميس 14 أغسطس حتى الساعة 8:30 مساءً يوم الجمعة 15 أغسطس.,gtfs-rt,https://api.opendata.transport.vic.gov.au/opendata/public-transport/gtfs/realtime/v1/metro/service-alerts
f94ec138-95c8-50ca-9943-de68f2881585,2025-08-14T13:42:59+10:00,train,aus:vic:vic-02-SUY:;aus:vic:vic-02-SUY-R:,Alamein,vic:rail:GIN;vic:rail:WFY;vic:rail:TOT;vic:rail:DRT;vic:rail:WGS;vic:rail:SAB;vic:rail:NME;vic:rail:MFY;vic:rail:ALB;vic:rail:KPL;vic:rail:SUY;vic:rail:SUN;vic:rail:FSY,Disruption from 10pm on Friday 15 August to 4am on Saturday 16 August.,There will be disruption from 10pm on Friday 15 August until 4am on Saturday 16 August.,从8月15日星期五晚上10点到8月16日星期六凌晨4点将有干扰。,سيكون هناك اضطراب من الساعة 10 مساءً يوم الجمعة 15 أغسطس حتى الساعة 4 صباحًا يوم السبت 16 أغسطس.,gtfs-rt,https://api.opendata.transport.vic.gov.au/opendata/public-transport/gtfs/realtime/v1/metro/service-alerts
88e59693-1c54-55c0-a4b2-7149e4fb0291,2025-08-14T13:42:59+10:00,train,aus:vic:vic-02-UFD-R:;aus:vic:vic-02-UFD:,Alamein,vic:rail:BAT;vic:rail:MYN;vic:rail:FBD;vic:rail:ASY;vic:rail:MAC;vic:rail:RPK;vic:rail:COB;vic:rail:MLD;vic:rail:GOW;vic:rail:FAK;vic:rail:BWK;vic:rail:JWL;vic:rail:UFD;vic:rail:NME,Disruption expected from 1am to 4am on Saturday 16 August.,There will be disruption from 1am to 4am on Saturday 16 August.,8月16日星期六凌晨1点到4点将会有干扰。,سيكون هناك اضطراب من الساعة 1 صباحًا حتى 4 صباحًا يوم السبت 16 أغسطس.,gtfs-rt,https://api.opendata.transport.vic.gov.au/opendata/public-transport/gtfs/realtime/v1/metro/service-alerts
eb4077f3-e770-5dd2-b136-5b42cff3ce65,2025-08-14T13:42:59+10:00,train,aus:vic:vic-02-CGB-R:;aus:vic:vic-02-CGB:,Alamein,vic:rail:BMS;vic:rail:RXP;vic:rail:ASV;vic:rail:ESD;vic:rail:CGB;vic:rail:NKT;vic:rail:GRY;vic:rail:MPD;vic:rail:OKP;vic:rail:GBV;vic:rail:JAC;vic:rail:CLO;vic:rail:PVL;vic:rail:SME;vic:rail:NME;vic:rail:KEN,Disruption from 1am to 4am on Saturday 16 August.,There will be disruption from 1am to 4am on Saturday 16 August.,8月16日星期六凌晨1点到4点将有干扰。,سيكون هناك اضطراب من الساعة 1 صباحًا حتى 4 صباحًا يوم السبت 16 أغسطس.,gtfs-rt,https://api.opendata.transport.vic.gov.au/opendata/public-transport/gtfs/realtime/v1/metro/service-alerts
c690fbd3-3627-5b5e-97e7-99f5382cd526,2025-08-14T13:42:59+10:00,train,aus:vic:vic-02-PKM-R:;aus:vic:vic-02-CBE-R:;aus:vic:vic-02-PKM:;aus:vic:vic-02-CBE:,Alamein,vic:rail:SNP;vic:rail:OFC;vic:rail:MRB;vic:rail:PKM;vic:rail:HUG;vic:rail:DNG;vic:rail:CDA;vic:rail:OAK;vic:rail:HUN;vic:rail:BEW;vic:rail:CBE;vic:rail:CNE;vic:rail:MPK;vic:rail:NPK;vic:rail:LBK;vic:rail:HLM;vic:rail:NWA;vic:rail:WTL;vic:rail:YMN;vic:rail:CFD;vic:rail:BFD;vic:rail:SPG;vic:rail:CLA,Disruption expected from 1am to 4am on Saturday 16 August.,There will be disruption from 1am to 4am on Saturday 16 August.,8月16日星期六凌晨1点到4点将会有干扰。,سيكون هناك اضطراب من الساعة 1 صباحًا حتى 4 صباحًا يوم السبت 16 أغسطس.,gtfs-rt,https://api.opendata.transport.vic.gov.au/opendata/public-transport/gtfs/realtime/v1/metro/service-alerts
d7417a67-72b8-5c3a-86ad-47253a335890,2025-08-14T13:42:59+10:00,train,aus:vic:vic-02-WIL:;aus:vic:vic-02-WIL-R:;aus:vic:vic-02-WER:;aus:vic:vic-02-WER-R:,Alamein,vic:rail:WBH;vic:rail:LAV;vic:rail:WTO;vic:rail:ALT;vic:rail:WER;vic:rail:WIL;vic:rail:SHE;vic:rail:ACF;vic:rail:SKN;vic:rail:SEN;vic:rail:NPT;vic:rail:WLD;vic:rail:NME;vic:rail:NWN;vic:rail:YVE;vic:rail:SPT;vic:rail:HCG;vic:rail:FSY,Disruption from 8.30pm on Friday 15 August to 5am on Saturday 16 August.,There will be disruption from 8.30pm on Friday 15 August until 5am on Saturday 16 August.,从8月15日星期五晚上8:30到8月16日星期六早上5:00将会有干扰。,سيكون هناك اضطراب من الساعة 8:30 مساءً يوم الجمعة 15 أغسطس حتى الساعة 5:00 صباحًا يوم السبت 16 أغسطس.,gtfs-rt,https://api.opendata.transport.vic.gov.au/opendata/public-transport/gtfs/realtime/v1/metro/service-alerts
a6e988bf-6fb8-5b95-ae17-908777f7919d,2025-08-14T13:42:59+10:00,train,aus:vic:vic-02-BEG:;aus:vic:vic-02-BEG-R:,Alamein,vic:rail:BAY;vic:rail:BOR;vic:rail:UPW;vic:rail:FTG;vic:rail:UFG;vic:rail:HMT;vic:rail:RWD;vic:rail:TCM;vic:rail:BEG,Transport will be disrupted from 10.30pm on 15 August to 5am on 16 August.,There will be transport disruptions from 10.30pm on 15 August until 5am on 16 August.,8月15日晚上10点30分至8月16日早上5点，交通将受到影响。,سيكون هناك اضطراب في وسائل النقل من الساعة 10:30 مساءً في 15 أغسطس حتى الساعة 5:00 صباحًا في 16 أغسطس.,gtfs-rt,https://api.opendata.transport.vic.gov.au/opendata/public-transport/gtfs/realtime/v1/metro/service-alerts
991dc749-8761-5c7d-ae1e-abb40fad4369,2025-08-14T13:42:59+10:00,train,aus:vic:vic-02-FKN-R:;aus:vic:vic-02-FKN:,Alamein,vic:rail:FKN,Level 6 of the car park is closed from 10pm on 3 August to 5pm on 16 August for works.,Level 6 of the car park will be closed from 10pm on 3 August until 5pm on 16 August for repairs.,多层停车场的6层将从8月3日晚上10点关闭，直到8月16日下午5点进行维修。,سيتم إغلاق المستوى السادس من موقف السيارات من الساعة 10 مساءً في 3 أغسطس حتى الساعة 5 مساءً في 16 أغسطس لأعمال الصيانة.,gtfs-rt,https://api.opendata.transport.vic.gov.au/opendata/public-transport/gtfs/realtime/v1/metro/service-alerts
1f6eac9f-00e3-5a13-8f85-2e7d6c18d6fc,2025-08-14T13:42:59+10:00,train,aus:vic:vic-02-UFD-R:;aus:vic:vic-02-CGB-R:;aus:vic:vic-02-UFD:;aus:vic:vic-02-CGB:,Alamein,vic:rail:BMS;vic:rail:ASY;vic:rail:ESD;vic:rail:MAC;vic:rail:COB;vic:rail:GOW;vic:rail:GBV;vic:rail:PVL;vic:rail:SSS;vic:rail:NME;vic:rail:BAT;vic:rail:FBD;vic:rail:RPK;vic:rail:NKT;vic:rail:FGS;vic:rail:BWK;vic:rail:JAC;vic:rail:UFD;vic:rail:FSS;vic:rail:RXP;vic:rail:MYN;vic:rail:CGB;vic:rail:MPD;vic:rail:JWL;vic:rail:SME;vic:rail:PAR;vic:rail:ASV;vic:rail:MCE;vic:rail:GRY;vic:rail:MLD;vic:rail:FAK;vic:rail:CLO;vic:rail:OKP;vic:rail:KEN,More trains will run from 4.30am Saturday to 12.30am Sunday compared to usual weekend services.,"From 4.30am Saturday to 12.30am Sunday, more trains will be available than usual.",从周六早上4:30到周日凌晨12:30，将提供比平常更多的列车。,من الساعة 4:30 صباحًا يوم السبت حتى الساعة 12:30 صباحًا يوم الأحد، ستتوفر المزيد من القطارات مقارنةً بالعطلات المعتادة.,gtfs-rt,https://api.opendata.transport.vic.gov.au/opendata/public-transport/gtfs/realtime/v1/metro/service-alerts
d58e9c24-a739-55df-a1aa-3cec455cfc42,2025-08-14T13:42:59+10:00,train,aus:vic:vic-02-CBE:;aus:vic:vic-02-SUY-R:;aus:vic:vic-02-SUY:;aus:vic:vic-02-PKM:;aus:vic:vic-02-CBE-R:;aus:vic:vic-02-PKM-R:,Alamein,vic:rail:FSY;vic:rail:CFD,"From 16 to 17 August, Metro Tunnel works will change train services in Melbourne. Passengers must change trains to reach the City.","From 16 to 17 August, train services will change. All trains will stop at Caulfield or Footscray. Change trains to go to the City.",从8月16日至17日，墨尔本的火车服务将发生变化。所有火车将在考尔菲尔德或富茨克雷停靠。前往市区需换乘。,من 16 إلى 17 أغسطس، ستتغير خدمات القطارات في ملبورن. يجب تغيير القطارات للوصول إلى المدينة.,gtfs-rt,https://api.opendata.transport.vic.gov.au/opendata/public-transport/gtfs/realtime/v1/metro/service-alerts
80bd391d-7b2c-504c-82a9-afe77b9e6fd7,2025-08-14T13:42:59+10:00,train,aus:vic:vic-02-WER:;aus:vic:vic-02-WER-R:,Alamein,vic:rail:LAV;vic:rail:WTO;vic:rail:ALT;vic:rail:SHE;vic:rail:ACF;vic:rail:NPT;vic:rail:WLD;vic:rail:HCG;vic:rail:WER,Disruption from 5am Saturday 16 August to last service Sunday 17 August.,Services will be disrupted from 5am on Saturday 16 August until the last service on Sunday 17 August.,从8月16日星期六上午5点到8月17日星期日最后一班服务，服务将受到影响。,سيكون هناك اضطراب من الساعة 5 صباحًا يوم السبت 16 أغسطس حتى آخر خدمة يوم الأحد 17 أغسطس.,gtfs-rt,https://api.opendata.transport.vic.gov.au/opendata/public-transport/gtfs/realtime/v1/metro/service-alerts
f6ad3306-5507-590b-b9b6-ac0f57eac421,2025-08-14T13:42:59+10:00,train,aus:vic:vic-02-WER:;aus:vic:vic-02-WER-R:,Alamein,vic:rail:LAV,Southern car park closed for project works from 2am 7 August to 3pm 18 August. Follow signage for safety.,The southern car park will be closed from 2am on 7 August to 3pm on 18 August. Follow signs for safety.,南停车场将于8月7日凌晨2点至8月18日下午3点关闭。请遵循安全标志。,سيتم إغلاق موقف السيارات الجنوبي من الساعة 2 صباحًا في 7 أغسطس حتى الساعة 3 مساءً في 18 أغسطس. يرجى اتباع علامات السلامة.,gtfs-rt,https://api.opendata.transport.vic.gov.au/opendata/public-transport/gtfs/realtime/v1/metro/service-alerts
84157d67-ab6f-5e0d-8622-2cc33a0afc17,2025-08-14T13:42:59+10:00,train,aus:vic:vic-02-WER:;aus:vic:vic-02-WER-R:,Alamein,vic:rail:WER,Car park closures from 3 to 23 August for bus operations and project works. Follow signage for safety.,"From 3 to 23 August, parts of the northern car park are closed for bus operations and project works. Follow signs for safety.",从8月3日至23日，北停车场部分区域因公交运营和项目工程关闭。请遵循标志以确保安全。,من 3 إلى 23 أغسطس، سيتم إغلاق أجزاء من موقف السيارات الشمالي بسبب عمليات الحافلات وأعمال المشروع. يرجى اتباع العلامات لضمان السلامة.,gtfs-rt,https://api.opendata.transport.vic.gov.au/opendata/public-transport/gtfs/realtime/v1/metro/service-alerts
4873038b-772b-5b86-861c-98aa3d907f60,2025-08-14T13:42:59+10:00,train,aus:vic:vic-02-FKN-R:;aus:vic:vic-02-FKN:,Alamein,vic:rail:MRN,8 car spaces closed from 28 July to 25 August for project works. Follow signage for safety.,"From 28 July to 25 August, 8 car spaces will be closed for work. Please follow the signs for your safety.",从7月28日到8月25日，8个停车位因工程关闭。请遵循标志以确保安全。,من 28 يوليو إلى 25 أغسطس، سيتم إغلاق 8 أماكن لوقوف السيارات لأعمال المشروع. يرجى اتباع اللافتات لسلامتك.,gtfs-rt,https://api.opendata.transport.vic.gov.au/opendata/public-transport/gtfs/realtime/v1/metro/service-alerts
0cd80bfd-1350-5a68-9796-d5206e9c985a,2025-08-14T13:42:59+10:00,train,aus:vic:vic-02-SUY:;aus:vic:vic-02-SUY-R:,Alamein,vic:rail:WGS,"From 7 July to late August, 90 car spaces in the south-east car park on Watergardens Circuit Road are closed for upgrades.","From 7 July to late August, 90 parking spaces in the south-east car park on Watergardens Circuit Road are closed for upgrades.",从7月7日到8月底，  东南停车场的90个停车位关闭进行升级。,من 7 يوليو حتى أواخر أغسطس، سيتم إغلاق 90 مكانًا لوقوف السيارات في موقف السيارات الجنوب الشرقي على طريق ووترغاردنز سيركيت لأعمال الترقية.,gtfs-rt,https://api.opendata.transport.vic.gov.au/opendata/public-transport/gtfs/realtime/v1/metro/service-alerts
86adae61-ee5b-51fc-a616-20d9ff0f171f,2025-08-14T13:42:59+10:00,train,aus:vic:vic-02-SUY:;aus:vic:vic-02-SUY-R:,Alamein,vic:rail:WGS,"From 27 May to mid-September, 50 parking spaces will be closed for construction. Alternative parking is available nearby.","From 27 May to mid-September, 50 parking spaces will be closed for construction. You can park at Watergardens Circuit Road or Keilor Plains Station.",从5月27日到9月中旬，将关闭50个停车位进行施工。您可以在  或  停车。,من 27 مايو إلى منتصف سبتمبر، سيتم إغلاق 50 مساحة لوقوف السيارات لأعمال البناء. يمكنك الوقوف في    أو محطة  .,gtfs-rt,https://api.opendata.transport.vic.gov.au/opendata/public-transport/gtfs/realtime/v1/metro/service-alerts
d3c80536-a46f-5c88-9d6e-87fb811a1a89,2025-08-14T13:42:59+10:00,train,aus:vic:vic-02-SUY:;aus:vic:vic-02-SUY-R:,Alamein,vic:rail:SUY,Car park closures and bus replacements from 20 July to mid-October due to upgrade works.,"From 20 July to mid-October, car park spaces are closed and buses are replacing trains due to works. Follow signs for safety.",从7月20日到10月中旬，停车场关闭，公交车替代火车，因施工。请遵循安全标志。,من 20 يوليو إلى منتصف أكتوبر، يتم إغلاق مواقف السيارات واستبدال الحافلات بالقطارات بسبب الأعمال. يرجى اتباع علامات السلامة.,gtfs-rt,https://api.opendata.transport.vic.gov.au/opendata/public-transport/gtfs/realtime/v1/metro/service-alerts
106db57d-b232-5feb-904a-909e11b6d305,2025-08-14T13:42:59+10:00,train,aus:vic:vic-02-PKM-R:;aus:vic:vic-02-CBE-R:;aus:vic:vic-02-PKM:;aus:vic:vic-02-CBE:,Alamein,vic:rail:DNG,"From 15 July to 20 November, half of the northern car park will be closed for construction of new staff facilities.",Half of the northern car park will be closed from 15 July to 20 November for building new staff facilities. Follow signs for safety.,从7月15日到11月20日，北停车场的一半将关闭，以建设新的员工设施。,من 15 يوليو إلى 20 نوفمبر، سيتم إغلاق نصف موقف السيارات الشمالي لأعمال بناء مرافق جديدة للموظفين.,gtfs-rt,https://api.opendata.transport.vic.gov.au/opendata/public-transport/gtfs/realtime/v1/metro/service-alerts
e7bfe520-70db-5bca-aadb-7444d4ee29c4,2025-08-14T13:42:59+10:00,train,aus:vic:vic-02-BEG:;aus:vic:vic-02-BEG-R:;aus:vic:vic-02-LIL:;aus:vic:vic-02-LIL-R:,Alamein,vic:rail:UNN,Car spaces closed due to project works from 6am Monday 7 April until late 2025. Additional spaces available on Bedford Avenue.,"From 6am on Monday 7 April until late 2025, some car spaces are closed for work. More spaces are on Bedford Avenue.",由于项目工程，从4月7日星期一早上6点起，停车位关闭至2025年底。贝德福德大道有额外停车位。,بسبب أعمال المشروع، سيتم إغلاق أماكن وقوف السيارات من الساعة 6 صباحًا يوم الاثنين 7 أبريل حتى أواخر عام 2025. توجد أماكن إضافية في شارع بيدفورد.,gtfs-rt,https://api.opendata.transport.vic.gov.au/opendata/public-transport/gtfs/realtime/v1/metro/service-alerts
b7cd2c75-9ae6-5098-a160-90e6d7982eff,2025-08-14T13:42:59+10:00,train,aus:vic:vic-02-SUY:;aus:vic:vic-02-SUY-R:,Alamein,vic:rail:DRT,Car park closures and shuttle bus service due to project works from 14 April to late 2025. Follow signage for safety.,Car parks will be closed at times from 14 April to late 2025. A shuttle bus will operate. Follow signs for safety.,由于项目工作，从4月14日到2025年底，停车场将不时关闭。将提供接驳巴士。请遵循标志以确保安全。,بسبب أعمال المشروع، ستغلق مواقف السيارات في أوقات مختلفة من 14 أبريل حتى أواخر 2025. سيتم تشغيل حافلة نقل. يرجى اتباع العلامات لضمان السلامة.,gtfs-rt,https://api.opendata.transport.vic.gov.au/opendata/public-transport/gtfs/realtime/v1/metro/service-alerts
805fbbd3-8879-5fd5-97f2-3dcdb73b47f9,2025-08-14T13:42:59+10:00,train,aus:vic:vic-02-SUY:;aus:vic:vic-02-SUY-R:,Alamein,vic:rail:SUN;vic:rail:ALB;vic:rail:TOT,Reduced parking at Albion station until 2025 due to Melbourne Airport Rail works. Consider walking or cycling.,Parking at Albion station is reduced until 2025 because of construction. Think about walking or cycling to the station.,由于墨尔本机场铁路工程，阿尔比恩车站的停车位将减少，直到2025年。请考虑步行或骑自行车前往车站。,سيتم تقليل مواقف السيارات في محطة ألباين حتى عام 2025 بسبب أعمال السكك الحديدية لمطار ملبورن. يرجى التفكير في المشي أو ركوب الدراجة.,gtfs-rt,https://api.opendata.transport.vic.gov.au/opendata/public-transport/gtfs/realtime/v1/metro/service-alerts
baf3f635-1091-560e-bbca-eac34c885be0,2025-08-14T13:42:59+10:00,train,aus:vic:vic-02-FKN-R:;aus:vic:vic-02-FKN:,Alamein,vic:rail:MOR,"From 9pm 18 August, underpass closes. Platform 2 closes from 29 August until mid 2026. All trains from Platform 1.",The underpass will close from 9pm on 18 August. Platform 2 will close from 29 August until mid 2026. All trains will use Platform 1.,从8月18日晚上9点开始，地下通道关闭。平台2将从8月29日关闭至2026年中。所有列车将从平台1发车。,من الساعة 9 مساءً في 18 أغسطس، سيتم إغلاق النفق. سيتم إغلاق المنصة 2 من 29 أغسطس حتى منتصف 2026. جميع القطارات ستغادر من المنصة 1.,gtfs-rt,https://api.opendata.transport.vic.gov.au/opendata/public-transport/gtfs/realtime/v1/metro/service-alerts
10955b17-724e-5d66-b5f6-0c116e59f89a,2025-08-14T13:42:59+10:00,train,aus:vic:vic-02-HBE:;aus:vic:vic-02-HBE-R:,Alamein,vic:rail:WAT,Watsonia Station car park closes 4 April. 500+ spaces at Frensham Reserve. No changes to bus stop or station access.,"From 4 April, Watsonia Station car park will close. Over 500 parking spaces are at Frensham Reserve. Bus stop and station access remain the same.",从4月4日起，车站停车场将关闭。 有500多个停车位。公交车站和车站通道不变。,اعتبارًا من 4 أبريل، سيتم إغلاق موقف سيارات محطة واتسونيا. يوجد أكثر من 500 مكان في فرينشام ريزيرف. لا تغييرات في موقف الحافلات أو الوصول إلى المحطة.,gtfs-rt,https://api.opendata.transport.vic.gov.au/opendata/public-transport/gtfs/realtime/v1/metro/service-alerts
SA.tt-463ebf20d9e1fd457b0e82579afde17ecc453326,2025-08-14T13:43:06+10:00,tram,,,,"Buses replace trams from Stop 53 Keilor Rd to Airport West, 18-20 Aug, 9pm to last service.","From 18 to 20 August, buses will replace trams from Stop 53 Keilor Rd to Airport West, from 9pm until the last service.",从8月18日至20日，每晚9点到最后一班，公交车将取代从53号站 到 的电车。,من 18 إلى 20 أغسطس، ستستبدل الحافلات الترام من محطة 53   إلى  ، من الساعة 9 مساءً حتى آخر خدمة.,gtfs-rt,https://api.opendata.transport.vic.gov.au/opendata/public-transport/gtfs/realtime/v1/tram/service-alerts
